{
  "version": "1.0.0",
  "last_updated": "2025-01-15",
  "role": "software-engineer",
  "track": "ic",
  "levels": {
    "ic1": {
      "title": "Junior Software Engineer",
      "experience": "0-2 years",
      "scope": "Task execution within defined boundaries",
      "competencies": [
        {
          "id": "code-quality",
          "name": "Code Quality",
          "definition": "Writing clean, tested, maintainable code for simple features",
          "levels": {
            "4": {
              "behaviors": [
                "Writes clean, readable code that follows team standards",
                "Includes appropriate tests for code changes",
                "Handles common edge cases and error conditions",
                "Code passes review with minor comments",
                "Commits are well-organized and documented"
              ]
            },
            "3": {
              "behaviors": [
                "Code works but has style/readability issues",
                "Tests are incomplete or missing",
                "Misses some edge cases",
                "Requires multiple review rounds for same issues"
              ]
            },
            "2": {
              "behaviors": [
                "Code frequently broken or doesn't compile",
                "Ignores feedback from reviews",
                "No tests or documentation"
              ]
            }
          }
        },
        {
          "id": "learning-agility",
          "name": "Learning Agility",
          "definition": "Ability to learn quickly and apply new knowledge effectively",
          "levels": {
            "4": {
              "behaviors": [
                "Asks thoughtful questions",
                "Takes notes and doesn't ask the same question twice",
                "Seeks out learning resources proactively",
                "Applies feedback from reviews to future work",
                "Shows improvement over time"
              ]
            },
            "3": {
              "behaviors": [
                "Asks questions but doesn't retain answers",
                "Waits to be taught instead of seeking information",
                "Slow to apply feedback",
                "Limited initiative in learning"
              ]
            },
            "2": {
              "behaviors": [
                "Doesn't ask questions when stuck",
                "Makes same mistakes repeatedly",
                "Resistant to learning new approaches"
              ]
            }
          }
        }
      ]
    },
    "ic2": {
      "title": "Software Engineer",
      "experience": "2-4 years",
      "scope": "Feature ownership with some independence",
      "competencies": [
        {
          "id": "code-quality",
          "name": "Code Quality",
          "definition": "Consistently producing well-engineered features with thorough testing",
          "levels": {
            "4": {
              "behaviors": [
                "Delivers complete, production-ready features",
                "Comprehensive test coverage including edge cases",
                "Code is performant and handles errors gracefully",
                "Proactively improves code quality beyond requirements",
                "Considers security and accessibility"
              ]
            },
            "3": {
              "behaviors": [
                "Features work but have gaps in testing or error handling",
                "Performance not considered",
                "Needs frequent guidance on quality expectations"
              ]
            },
            "2": {
              "behaviors": [
                "Frequent bugs in production",
                "Doesn't learn from quality issues",
                "Impacts team velocity"
              ]
            }
          }
        },
        {
          "id": "technical-problem-solving",
          "name": "Technical Problem Solving",
          "definition": "Ability to debug issues and solve technical problems independently",
          "levels": {
            "4": {
              "behaviors": [
                "Debugs and resolves issues systematically",
                "Uses appropriate tools and techniques",
                "Identifies root causes, not just symptoms",
                "Documents solutions for others",
                "Knows when to escalate vs. keep digging"
              ]
            },
            "3": {
              "behaviors": [
                "Can solve problems but takes too long",
                "Doesn't document solutions",
                "Sometimes treats symptoms rather than causes"
              ]
            },
            "2": {
              "behaviors": [
                "Cannot debug without significant help",
                "Gets stuck and doesn't ask for help",
                "Applies random fixes hoping something works"
              ]
            }
          }
        },
        {
          "id": "collaboration",
          "name": "Collaboration",
          "definition": "Working effectively with team members and stakeholders",
          "levels": {
            "4": {
              "behaviors": [
                "Participates actively in code reviews (giving and receiving)",
                "Communicates clearly in written and verbal formats",
                "Helps teammates when asked",
                "Raises concerns and suggestions constructively",
                "Keeps stakeholders informed"
              ]
            },
            "3": {
              "behaviors": [
                "Participates minimally in team activities",
                "Communication is unclear or inconsistent",
                "Works in isolation"
              ]
            },
            "2": {
              "behaviors": [
                "Dismissive in code reviews",
                "Poor communication causing issues",
                "Creates friction with teammates"
              ]
            }
          }
        }
      ]
    },
    "ic3": {
      "title": "Senior Software Engineer",
      "experience": "4-7 years",
      "scope": "Technical leadership within the team",
      "competencies": [
        {
          "id": "code-quality",
          "name": "Code Quality",
          "definition": "Setting and exemplifying code quality standards for the team",
          "levels": {
            "4": {
              "behaviors": [
                "Code serves as example for team",
                "Identifies and pays down tech debt",
                "Improves team standards and practices",
                "Catches subtle issues in code reviews",
                "Considers long-term maintainability"
              ]
            },
            "3": {
              "behaviors": [
                "Good personal code quality but doesn't raise team level",
                "Doesn't address tech debt",
                "Reviews are superficial"
              ]
            },
            "2": {
              "behaviors": [
                "Quality regression from IC2 level",
                "Negative impact on team standards"
              ]
            }
          }
        },
        {
          "id": "technical-problem-solving",
          "name": "Technical Problem Solving",
          "definition": "Solving complex problems and helping others develop problem-solving skills",
          "levels": {
            "4": {
              "behaviors": [
                "Solves complex, ambiguous problems",
                "Teaches problem-solving approaches to others",
                "Anticipates problems before they occur",
                "Creates tools or docs that help team solve problems"
              ]
            },
            "3": {
              "behaviors": [
                "Solves own problems but doesn't help others",
                "Doesn't anticipate issues",
                "Hoards knowledge"
              ]
            },
            "2": {
              "behaviors": [
                "Struggles with complex problems",
                "Cannot guide others"
              ]
            }
          }
        },
        {
          "id": "system-design",
          "name": "System Design",
          "definition": "Designing and implementing complex features and systems",
          "levels": {
            "4": {
              "behaviors": [
                "Designs features that are scalable, reliable, and maintainable",
                "Considers operational concerns (monitoring, debugging, deployment)",
                "Makes appropriate trade-offs and documents decisions",
                "Breaks down complex work for team",
                "Understands and improves overall system architecture"
              ]
            },
            "3": {
              "behaviors": [
                "Designs work but miss important considerations",
                "Doesn't document decisions",
                "Over-engineers or under-engineers solutions"
              ]
            },
            "2": {
              "behaviors": [
                "Designs cause problems in production",
                "Cannot handle complexity at this level"
              ]
            }
          }
        },
        {
          "id": "mentoring",
          "name": "Mentoring",
          "definition": "Developing junior team members through guidance and feedback",
          "levels": {
            "4": {
              "behaviors": [
                "Actively mentors 1-2 junior engineers",
                "Provides regular, actionable feedback",
                "Helps mentees set and achieve goals",
                "Creates learning opportunities",
                "Adjusts approach based on mentee needs"
              ]
            },
            "3": {
              "behaviors": [
                "Answers questions but doesn't proactively mentor",
                "Feedback is too harsh or too gentle",
                "Doesn't follow up on mentee progress"
              ]